{
    "id"    : "light",
    "label" : "ThemeLight",
    "type"  : "system",
    "badge" : {
        "color-bg": "#0652dd",
        "color-fg": "#ffffff",
        "icon"    : null
    },
    "font"  : {
        "family": "default",
        "size"  : "d"
    },
    "colors": {
        "element-bg"             : "#ffffff",
        "element-fg"             : "#000000",
        "element-hover-bg"       : "#ededed",
        "element-hover-fg"       : "#000000",
        "element-active-bg"      : "#ffffff",
        "element-active-fg"      : "#0996f8",
        "element-active-hover-bg": "#ededed",
        "element-active-hover-fg": "#0670cc",
        "button-bg"              : "inherit",
        "button-fg"              : "inherit",
        "button-hover-bg"        : "#0996f8",
        "button-hover-fg"        : "#ffffff",
        "slider-bg"              : "#eeeeee",
        "slider-fg"              : "#ffffff",
        "slider-br"              : "#dcdddd",
        "slider-active-bg"       : "#0060df",
        "slider-active-fg"       : "#ffffff",
        "slider-active-br"       : "#003eaa",
        "info-bg"                : "#0652dd",
        "info-fg"                : "#ffffff",
        "warning-bg"             : "#ffc312",
        "warning-fg"             : "#ffffff",
        "error-bg"               : "#ff3f34",
        "error-fg"               : "#ffffff",
        "success-bg"             : "#05c46b",
        "success-fg"             : "#ffffff"
    }
}