{
    "id": "adapta-teal",
    "label": "ThemeAdaptaTeal",
    "type"  : "system",
    "badge" : {
        "color-bg": "#37EE7C",
        "color-fg": "#F9F9FA",
        "icon"    : "passwords-new-light"
    },
    "font"  : {
        "family": "default",
        "size"  : "d"
    },
    "colors": {
        "element-bg"             : "#202023",
        "element-fg"             : "#858586",
        "element-hover-bg"       : "#263238",
        "element-hover-fg"       : "#F9F9FA",
        "element-active-bg"      : "#263238",
        "element-active-fg"      : "#37EE7C",
        "element-active-hover-bg": "#263238",
        "element-active-hover-fg": "#37EE7C",
        "button-bg"              : "inherit",
        "button-fg"              : "inherit",
        "button-hover-bg"        : "#37EE7C",
        "button-hover-fg"        : "#F9F9FA",
        "slider-bg"              : "#263238",
        "slider-fg"              : "#37EE7C",
        "slider-br"              : "#37EE7C",
        "slider-active-bg"       : "#37EE7C",
        "slider-active-fg"       : "#263238",
        "slider-active-br"       : "#37EE7C",
        "info-bg"                : "#0c63db",
        "info-fg"                : "#ffffff",
        "warning-bg"             : "#eca700",
        "warning-fg"             : "#ffffff",
        "error-bg"               : "#e9322d",
        "error-fg"               : "#ffffff",
        "success-bg"             : "#46ba61",
        "success-fg"             : "#ffffff"
    }
}